{
  "case_id": "synthetic.raw-framing.example",
  "case_manifest_sha256": "0000000000000000000000000000000000000000000000000000000000000000",
  "contract_schema": 1,
  "oracle_profile": "cmake-qt5",
  "output": {
    "expected_json_documents": 1,
    "kind": "normal_scan_json"
  },
  "platform": "linux-x86_64",
  "semantic_schema": 1,
  "upstream_commit": "74eaf505c250ab47e709024e9dc41657cd8f2254"
}
